{
  "lessonId": "a1-ch1-l1",
  "chapterId": "a1-ch1",
  "level": "A1",
  "title": "Basic Greetings",
  "anchorSkill": "reading",
  "durationMinutes": 22,
  "objectives": [
    "Recognize and use the core greeting and farewell expressions, matched correctly to time of day and formality."
  ],
  "grammarFocus": "Introduction to être: je suis / tu es, used only in the fixed pattern 'Je suis... / Tu es...'",
  "vocabularyFocus": "bonjour, bonsoir, salut, au revoir, à bientôt, bonne nuit, madame, monsieur",

  "warmUp": {
    "content": "Think about how you greet people in your own language. Do you say something different in the morning than at night? Do you greet a stranger the same way you greet a close friend? Keep these questions in mind — French makes some of the same distinctions, and a few new ones."
  },

  "explanation": {
    "content": "French greetings change depending on two things: the time of day and how well you know the person. Bonjour ('hello' / 'good day') is the all-purpose daytime greeting, used with anyone from morning until early evening. Bonsoir ('good evening') replaces bonjour once evening arrives. Salut ('hi' / 'bye') is casual and only used with people you know well. Au revoir ('goodbye') works in any situation, formal or informal. À bientôt ('see you soon') is warm and casual. Bonne nuit ('good night') is used only when someone is going to bed, not as a general evening farewell. Madame and Monsieur are polite titles added after bonjour/bonsoir when addressing someone you don't know well."
  },

  "vocabulary": [
    { "french": "bonjour", "english": "hello / good day", "pronunciation": "bohn-ZHOOR", "example": "Bonjour, Madame !" },
    { "french": "bonsoir", "english": "good evening", "pronunciation": "bohn-SWAHR", "example": "Bonsoir, Monsieur." },
    { "french": "salut", "english": "hi / bye (informal)", "pronunciation": "sah-LU", "example": "Salut, Marc ! Ça va ?", "formality": "informal" },
    { "french": "au revoir", "english": "goodbye", "pronunciation": "oh ruh-VWAHR", "example": "Au revoir, à demain !" },
    { "french": "à bientôt", "english": "see you soon", "pronunciation": "ah byan-TOH", "example": "Merci, à bientôt !" },
    { "french": "bonne nuit", "english": "good night", "pronunciation": "bun NWEE", "example": "Bonne nuit, dors bien.", "usageNote": "Only said when someone is actually going to bed." },
    { "french": "madame", "english": "madam / Mrs.", "pronunciation": "mah-DAM", "example": "Bonjour, madame Girard.", "formality": "formal" },
    { "french": "monsieur", "english": "sir / Mr.", "pronunciation": "muh-SYUR", "example": "Bonsoir, monsieur Dubois.", "formality": "formal" }
  ],

  "grammar": {
    "explanation": "This lesson introduces only a small, fixed piece of the verb être ('to be'): the phrase pattern Je suis... ('I am...') used to state your name. The full conjugation of être is built gradually across this chapter.",
    "formation": "Je suis + [name] → 'I am [name].'",
    "usage": "This pattern is commonly used right after a greeting, when meeting someone for the first time: Bonjour, je suis Claire.",
    "examples": [
      "Bonjour, je suis Antoine.",
      "Bonsoir, je suis Madame Lefèvre.",
      "Salut, je suis Léa !"
    ],
    "commonMistakes": [
      {
        "wrong": "Je suis à Claire.",
        "correct": "Je suis Claire.",
        "why": "No preposition is needed before a name with être.",
        "tip": "Just Je suis + name, nothing in between."
      },
      {
        "wrong": "je suis claire",
        "correct": "Je suis Claire.",
        "why": "Proper names are always capitalized in French, exactly as in English.",
        "tip": "Capitalize the name every time."
      }
    ]
  },

  "grammarDrills": {
    "questions": [
      {
        "id": "a1-ch1-l1-gd-1",
        "type": "fill_blank",
        "prompt": "Bonjour, __________. (complete with 'Je suis' + your own name)",
        "correctAnswer": "Je suis [your name]",
        "explanation": "Je suis + name is the fixed pattern taught in this lesson for stating your name after a greeting."
      },
      {
        "id": "a1-ch1-l1-gd-2",
        "type": "fill_blank",
        "prompt": "Salut, __________ ! (complete with 'Je suis' + your own name)",
        "correctAnswer": "Je suis [your name]",
        "explanation": "The same Je suis + name pattern works after any greeting, formal or informal."
      }
    ]
  },

  "reading": {
    "title": "Deux Rencontres (Two Encounters)",
    "text": "Le matin, au bureau :\nCamille : Bonjour, Madame Petit !\nMadame Petit : Bonjour ! Je suis Madame Petit.\nCamille : Je suis Camille. Enchantée !\n\nLe soir, dans la rue :\nHugo : Salut, Léa !\nLéa : Salut, Hugo ! Ça va ?\nHugo : Ça va, merci. Bonne nuit, à bientôt !\nLéa : À bientôt !",
    "translation": "In the morning, at the office:\nCamille: Hello, Madame Petit!\nMadame Petit: Hello! I am Madame Petit.\nCamille: I am Camille. Nice to meet you!\n\nIn the evening, on the street:\nHugo: Hi, Léa!\nLéa: Hi, Hugo! How's it going?\nHugo: Good, thanks. Good night, see you soon!\nLéa: See you soon!",
    "questions": [
      {
        "id": "a1-ch1-l1-r-1",
        "type": "short_answer",
        "prompt": "What time of day does the first conversation happen?",
        "correctAnswer": "Morning (le matin).",
        "explanation": "The text explicitly labels the scene 'Le matin, au bureau.'"
      },
      {
        "id": "a1-ch1-l1-r-2",
        "type": "multiple_choice",
        "prompt": "Which greeting does Camille use with Madame Petit?",
        "options": ["Salut", "Bonjour", "Bonsoir"],
        "correctAnswer": "Bonjour",
        "explanation": "It's morning and a formal workplace context, so Camille uses Bonjour."
      },
      {
        "id": "a1-ch1-l1-r-3",
        "type": "short_answer",
        "prompt": "Why does Hugo use salut instead of bonjour?",
        "correctAnswer": "Because he knows Léa well and it's an informal situation.",
        "explanation": "Salut is reserved for people you know well, unlike the all-purpose bonjour."
      },
      {
        "id": "a1-ch1-l1-r-4",
        "type": "fill_blank",
        "prompt": "What does Léa say at the very end?",
        "correctAnswer": "À bientôt !",
        "explanation": "Léa's final line in the dialogue is 'À bientôt !'"
      }
    ]
  },

  "listening": {
    "title": "Au Café",
    "transcript": "Serveur : Bonsoir, Madame !\nCliente : Bonsoir, Monsieur.\nServeur : Vous êtes Madame Lambert ?\nCliente : Oui, je suis Madame Lambert.\nServeur : Merci ! Au revoir, bonne soirée.\nCliente : Au revoir !",
    "translation": "Waiter: Good evening, Madam!\nCustomer: Good evening, Sir.\nWaiter: Are you Madame Lambert?\nCustomer: Yes, I am Madame Lambert.\nWaiter: Thank you! Goodbye, have a good evening.\nCustomer: Goodbye!",
    "questions": [
      {
        "id": "a1-ch1-l1-li-1",
        "type": "true_false",
        "prompt": "The conversation happens in the morning.",
        "options": ["True", "False"],
        "correctAnswer": "False",
        "explanation": "The waiter says 'Bonsoir', which signals evening, not morning."
      },
      {
        "id": "a1-ch1-l1-li-2",
        "type": "true_false",
        "prompt": "The customer's name is Madame Lambert.",
        "options": ["True", "False"],
        "correctAnswer": "True",
        "explanation": "She confirms this directly: 'Oui, je suis Madame Lambert.'"
      },
      {
        "id": "a1-ch1-l1-li-3",
        "type": "true_false",
        "prompt": "The waiter says salut at the end.",
        "options": ["True", "False"],
        "correctAnswer": "False",
        "explanation": "He says 'Au revoir', the standard goodbye, not the informal salut."
      }
    ]
  },

  "speaking": {
    "guidedActivity": "Practice saying bonjour and bonsoir aloud, paying attention to the difference in mouth position between the open 'oh' sound in bonjour and the rounder 'wah' sound in bonsoir.",
    "roleplay": "Person A greets Person B as a stranger in the morning, using Madame/Monsieur. Person B replies and introduces themselves with Je suis.... Both say goodbye with au revoir.",
    "pronunciationTip": "The 'r' in bonjour and au revoir is made in the back of the throat — softer than an English 'r.' Don't worry about perfecting it yet; just get comfortable attempting it."
  },

  "writing": {
    "task": "Write a 2–3 sentence mini-dialogue in which you greet someone in the evening, introduce yourself, and say goodbye.",
    "modelAnswer": "Bonsoir, Madame. Je suis Julien. Au revoir, à bientôt !",
    "checklist": [
      "Used a greeting that matches evening time (bonsoir, not bonjour).",
      "Introduced yourself with Je suis.",
      "Included a farewell expression."
    ]
  },

  "practiceExercises": {
    "questions": [
      {
        "id": "a1-ch1-l1-pe-1",
        "type": "multiple_choice",
        "prompt": "Which greeting is correct at 9:00 PM?",
        "options": ["Bonjour", "Salut", "Bonsoir", "Bonne nuit (as a greeting)"],
        "correctAnswer": "Bonsoir",
        "explanation": "9:00 PM is evening, so bonsoir is correct; bonne nuit is reserved for bedtime specifically."
      },
      {
        "id": "a1-ch1-l1-pe-2",
        "type": "matching",
        "prompt": "Match the expression to its use.",
        "pairs": [
          { "left": "Salut", "right": "Informal hello/goodbye" },
          { "left": "Bonjour", "right": "Formal daytime greeting" },
          { "left": "Bonne nuit", "right": "Said only when going to bed" }
        ],
        "correctAnswer": [
          { "left": "Salut", "right": "Informal hello/goodbye" },
          { "left": "Bonjour", "right": "Formal daytime greeting" },
          { "left": "Bonne nuit", "right": "Said only when going to bed" }
        ],
        "explanation": "Each expression maps to exactly one register/usage as taught in this lesson."
      },
      {
        "id": "a1-ch1-l1-pe-3",
        "type": "fill_blank",